Title,Year & Authors,Application Domain,Dataset,Architecture,Wavelet / Pooling Technique,Quantitative Results,Outcomes,Main Contribution / Innovation,Model Robustness,Limitations,Loss Function,Training Strategy,GAN Variant,Discriminator / Generator Type,Pooling Layer / Wavelet Location,Comparative Analysis,Input Size / Resolution,Baseline for Comparison,Layer Composition,Code Availability,Cross-Dataset Generalization,Complexity and Scalability,Optimization Algorithms,Training Dynamics / Regularization / Convergence,Feature Representation / Extraction,,,,,,,,,,,,,
GAN WITH ASPP FOR SAR IMAGE TO OPTICAL IMAGE CONVERSION,"2022, Shao et al.",SAR-to-optical image conversion,"SEN1-2 dataset (city, desert, farmland, forest); 7649 images total split across four subsets","GAN (with ASPP module, called ASPP-GAN)",Atrous Spatial Pyramid Pooling (ASPP) applied in the encoder before first convolution block to extract multi-scale features,"Forest: PSNR 24.956, SSIM 0.810; Farmland: PSNR 25.315, SSIM 0.836; City: PSNR 26.688, SSIM 0.861; Desert: PSNR 26.241, SSIM 0.838; ~20% improvement over raw GAN except forest (+3%)","ASPP-GAN substantially improves detail and color restoration in SAR-to-optical translation, outperforming baseline GANs on all categories, especially farmland, city, and desert; adds multi-scale feature extraction and achieves notable PSNR/SSIM gains","Introduction of ASPP into GAN generator for multi-resolution feature extraction, enabling improved restoration of both global structure and image detail in SAR-to-optical tasks","Performance demonstrated across multiple land categories; model shows improved accuracy and detail restoration compared to raw GAN; some cross-type generalization across city, desert, farmland, and forest subsets",Limited GPU memory (batch size 4); future work involves trying additional feature extraction methods and deeper understanding of ASPP's effect; ASPP improves less on forest than on other categories; code availability is not mentioned,"L2 (per-pixel) loss and adversarial loss, combined in total loss function with weighting parameters","Supervised, with paired SAR-optical training examples",Not specified,"Generator: encoder (with ASPP), residual modules for modality conversion, 6 deconvolution modules for decoding; Discriminator: CNN with three Conv-BN-LeakyReLU blocks","ASPP (atrous spatial pyramid pooling) located at the start of generator encoder, before first convolution block",Compared against standard GAN (raw); ablation study on ASPP's contribution to PSNR/SSIM,3×256×256,GAN (raw); references to VGG19-loss GAN [2] and supervised CycleGAN [3],"Generator: ASPP, convolutional layers, residual modules, deconvolutions; Discriminator: Conv-BN-LeakyReLU stacks",Not specified,Evaluated within SEN1-2 subsets but not explicitly on external datasets; cross-category within SEN1-2 only,Batch size limited by GPU memory (set at 4); ASPP increases complexity modestly; scalability to larger batches/resolutions not discussed,Adam optimizer (learning rate 0.00005),"Training dynamics stable after tuning dilated convolution rates (3, 5, 9 for ASPP); 500 epochs; regularization not explicitly mentioned",ASPP enables extraction of multi-scale features including both global (structure) and fine (detail) representations from SAR images,,,,,,,,,,,,,
High-turbidity underwater active single-pixel imaging based on generative adversarial networks with double Attention U-Net under low sampling rate,"2023, Feng et al.","Underwater imaging, single-pixel imaging under high turbidity and low sampling rates","GTSRB German traffic sign dataset (7700 images train/1000 test), EMNIST handwritten dataset (12,000 images), custom images (e.g., 'smiley face', 'ZS', 'exclamation mark'); physical water tank with varying turbidity (43–128 NTU)","UASPI-DAUGAN (double Attention U-Net generator, Path-GAN discriminator); EGAN, U-Net, CSSPI (for comparison)",Atrous Spatial Pyramid Pooling (ASPP) between encoder and decoder for multi-scale feature extraction; Max pooling (2x2) in encoder; cSE (concurrent spatial and channel 'squeeze & excitation' blocks) in encoder and decoder,"PSNR (e.g., 23.9 dB at 19.14% sampling/20 dB at 3.52% in simulation, 15.46% higher than U-Net at 3.52% sampling at 128NTU in experiment), SSIM (e.g., 0.95 at 19.14%/0.91 at 3.52% in simulation, up to 21.97% higher than U-Net at 3.52%/128NTU); values reported across turbulence (SNR and NTU levels) and methods",Reconstructs high-fidelity underwater target images at 3.52% sampling rate in 128NTU turbidity; outperforms baseline methods in PSNR and SSIM under low-sampling and high-turbidity; maintains generalization to unseen targets and datasets,"Proposes a GAN with double Attention U-Net generator, double skip connections, ASPP and cSE modules for multi-scale and redundancy removal, and MSSIM+L1+LSGAN loss for robust underwater SPI at low sampling rates; validates both in simulation and experiments under challenging conditions","Demonstrates strong reconstruction ability and generalization to unseen data (EMNIST, novel experimental targets); ablation studies and cross-dataset results indicate stable performance in different noise/turbidity levels and dataset switches",Generator architecture is complex and increases training time compared to simpler EGAN; explicit code not provided; training set for physical experiments not made public; possible future work to simplify network and system,"Least squares adversarial loss (LSGAN), L1 content loss, mean structural similarity (MSSIM) loss; combined in weighted joint objective",Supervised (paired 1D measurement vectors and ground truth images),"LSGAN (Least Squares GAN), cGAN used in methodology or for comparison","Generator: double Attention U-Net with ASPP and cSE, double skip connections; Discriminator: PatchGAN (Path-GAN structure with 5 conv + BN + LeakyReLU blocks)","Max pooling in encoder; Atrous Spatial Pyramid Pooling (ASPP) between encoder and decoder; cSE in encoder/decoder; skip connections at multiple levels, including across U-Nets","Compared to CSSPI, U-Net, EGAN, and internal ablations (w/o ASPP, cSE, MSSIM); UASPI-DAUGAN achieves highest PSNR/SSIM values, especially under strong scattering/low sampling. Ablations show degradation when omitting ASPP/cSE/MSSIM",32×32 images (both input signal and output images); Hadamard patterns also 32×32; DMD loaded with 1024×1024 micromirror units for 32×32 effective pixels,"Baseline: CSSPI (with TVAL3 optimization), U-Net, EGAN (GAN with U-Net generator), and several ablations (UASPI-DAUGAN w/o ASPP/cSE/MSSIM)","Conv-BN-ReLU stacks; double Attention U-Nets (each encoder: 4 downsamplers; decoder: 4 upsamplers; ASPP; cSE blocks); skip connections (intra/inter U-Nets); Discriminator: 5 conv modules (with BN, LeakyReLU)",Not specified,"Tested on EMNIST and unseen 'exclamation mark' images, as well as novel experimental targets (e.g., double-character 'ZS'), indicating good cross-dataset generalization",Generator complexity higher than EGAN; longer training time; scalability to higher resolutions not discussed; network could be streamlined in future work,Adam optimizer (learning rate 0.0002),"Training stable with LSGAN loss, joint losses (L1, MSSIM, least squares) to avoid gradient disappearance/crash; BN for normalization in all conv modules",Wavelet and frequency-domain features not explicit; ASPP for multi-scale features; cSE and Attention U-Net for spatial/channel salient features; 1D measurement vector input mapped to image features,,,,,,,,,,,,,
Image color rendering based on frequency channel attention GAN,"2024, Li et al.",Image color rendering,"DIV2K, COCO",GAN with U-Net backbone,Frequency channel attention mechanism utilizing DCT-based frequency pooling; replaces/integrates with global average pooling in attention,"On COCO, PSNR increased by 2.660 (vs. pix2pix), 2.595 (vs. CycleGAN), 1.430 (vs. HCEGAN); SSIM up 7.943%, 6.790%, 2.436%; Specifics: e.g., PSNR/SSIM on Fish: 20.409/84.187; Dog: 24.384/89.858","Improved rendering effect and quality, clearer details, enhanced model stability especially in complex scenes","Proposed a frequency channel attention mechanism generalizing channel attention from global average pooling to DCT-derived frequency features, improving feature representation while reducing complexity",Robustness shown by consistent improvements across COCO and DIV2K datasets; demonstrated effectiveness in complex scenes,Adding more DCT layers increases complexity without guaranteed further gains; no explicit discussion of other shortcomings,Adversarial loss plus λL1 loss (λ=100),Supervised training,cGAN (conditional GAN),"U-Net-based generator, PatchGAN discriminator (70x70), generator uses skip connections and frequency attention","Frequency/channel attention applied in generator, leveraging DCT frequency components in the attention blocks","Compared to pix2pix, CycleGAN, HCEGAN; outperformed all on PSNR and SSIM; ablation on frequency components (GAP vs. DCT variants)",256×256,"pix2pix, CycleGAN, HCEGAN",Conv-Regularity-LeakyReLU stacks in discriminator; U-Net with skip connections and frequency attention in generator,Not specified,Tested on DIV2K and COCO datasets; demonstrates cross-dataset validity,"Model output improves or saturates with more DCT layers, but computation and complexity increase; Ours(2) is chosen for balance of performance and efficiency; lightweight feature","Adam (β1=0.5, β2=0.999, lr=0.0002)","Adversarial loss combined with L1 for stable training; simple patch-based discriminator; L1 loss as regularization, frequency attention for improved convergence",Learned channel features in frequency domain (DCT spectrum) improve feature expressivity and rendering accuracy over GAP-based attention,,,,,,,,,,,,,
Image Reconstruction for Rain Removal in Both Wavelet and Spatial Frequency Sub-bands Using W-CycleGANs,"2023, Tang et al.",Rain removal from images (single image rain removal),700 pairs of synthetically generated rain/no-rain images for training; five categories of real rain images for testing (as in [4]),W-CycleGAN (CycleGAN backbone in two stages),"Haar wavelet transform: 1-level DWT on V-channel of HSV in first stage CycleGAN, with IDWT for reconstruction; applied for high-frequency sub-band processing","NIQE (Natural Image Quality Evaluator): W-CycleGAN achieves lower NIQE values than CycleGAN across five categories (exact values in Fig. 14.10, but lowest among compared approaches, showing better performance)",Superior real rain removal performance with preservation of scene details; effective removal at both high and low frequency bands in five categories of challenging rain phenomena,"Introduction of a two-stage CycleGAN framework (W-CycleGANs) for deraining, with Stage 1 in wavelet domain (frequency sub-bands) and Stage 2 in spatial-frequency; employs wavelet decomposition on luminance channel and tailored gamma correction",Demonstrated robust performance across five diverse rain scenarios; model generalizes to real rain images after training on synthetic pairs; two-stage design preserves details and effectively removes both high/low frequency rain distortions,"Further correction (e.g., brightness adjustment) needed to improve image reconstruction; no paired real rain/no-rain images exist—testing relies on qualitative and NIQE metrics; detailed optimal gamma parameter tuning not exhaustively discussed; extension to video suggested as future work","Adversarial GAN loss and cycle-consistency loss (weighted sum, as in Eq. 14.1)","Unsupervised (unpaired image-to-image translation, CycleGAN paradigm); both stages trained simultaneously (end-to-end)",CycleGAN (two-stage architecture); not conditional,"2 generators and 2 discriminators per CycleGAN; specific architecture not exhaustively detailed, but as in CycleGAN (likely PatchGAN)","Wavelet DWT in first stage encoder on luminance/V channel; IDWT after first stage output, before second-stage CycleGAN; gamma correction after first stage and before second stage on LL sub-band and S channel",Yes; both qualitative and quantitative (NIQE) comparisons with baseline CycleGAN; W-CycleGAN outperforms CycleGAN in all tested scenarios,"Not explicitly stated; input images downsampled after wavelet/DWT, but base data is typical image sizes (likely 256×256 or similar)","Baseline CycleGAN and ID-CGAN; comparison made to CycleGAN, as in [4]","Not fully detailed; follows CycleGAN backbone, likely Conv-BN-ReLU stacks in both generator/discriminator, two-stage (one per frequency/spatial domain)",Not specified,Method tested on five real rain categories after training on synthetic data; supports some cross-domain generalization but not explicitly tested with unrelated datasets,"Discussion on computational practicality (no need for paired images); scalability not explicitly analyzed; run on a single GTX-1070 GPU, training for 200 epochs","Adam optimizer (implied by CycleGAN paradigm and PyTorch context, but not textually confirmed)",Demonstrated training stability with two loss functions; high model performance after 200 epochs; use of regularization via cycle-consistency loss; convergence implied by superior NIQE/qualitative results,Emphasizes capture and removal of rain artifacts by processing image features in orthogonal (LH/HL/HH) wavelet sub-bands on luminance; preservation of scene details attributed to localized frequency-domain operations and two-stage design,,,,,,,,,,,,,
Improved Scalp Swarm Optimization with Generative Adversarial Network for Recognition of Motor Imagery EEG,"2024, Stephen et al.",Motor imagery EEG recognition (brain-computer interface),"BCI Competition III dataset III(a), BCI Competition III dataset IV(a)","CGAN (Conditional GAN); compared with CNN (AlexNet, ResNet)",Discrete Wavelet Transform (DWT) used after EMD for feature extraction; DWT applied to average IMF signals from selected EEG channels in feature extraction pipeline,CGAN multiclass accuracy: 89.11%; CNN (AlexNet) multiclass accuracy: 81.61%; CGAN (2-class) up to 95.29%; existing SOTA: 85-90%,Model achieved state-of-the-art accuracy for both binary and multi-class MI-EEG classification; optimization (SSO) further improved accuracy and computational time,Introduced combination of Scalp Swarm Optimization (SSO) with CGAN for MI-EEG feature extraction and classification; DWT for enhanced signal extraction; novel optimization pipeline,Results show good generalization within tested subjects and datasets; includes ablation and comparative studies with various optimizers; explicit discussion of stability and loss convergence,Model robustness degrades in multiclass without optimizer; generalization limited to dataset population; limitations in interpretability and applicability to non-target populations; future work on generalization and cross-domain security recommended,"Adversarial loss (binary cross-entropy), CGAN objective; loss functions defined for generator and discriminator; no explicit mention of additional L1/perceptual losses","Supervised learning with optimizer-improved parameter tuning; 70% training / 30% test split; ablation with different optimization strategies including SSO, PSO, ACO, Whale","cGAN (conditional GAN), compared to DCGAN, standard GAN; baseline GANs employed for comparison","Generator and discriminator: both sequential, four-layer fully connected MLPs with LeakyReLU, BatchNorm and Dropout; no pooling layers in CNNs; GAN generator input 8×8×256, output 32×32×n",Wavelet (DWT) used after EMD on averaged channel signals; pooling layers removed from CNN-based GAN variants; DWT explicitly for signal extraction after feature aggregation,"Comprehensive ablation: SSO-optimized CGAN vs. baseline CGAN, CNN (AlexNet/ResNet) and optimizers (PSO, ACO, Whale); CGAN/SSO outperforms all with accuracy gains 4–10%","EEG trials converted to 32×32 matrices for input; exact input size 32×32; CNN (AlexNet) used 128×128 for some tests, ResNet 32×32×1","SVM, ANN, CNN (AlexNet, ResNet), standard GANs; published accuracy numbers and comparisons in Table 10",CGAN/SSO: sequential Dense (FC)–LeakyReLU–BatchNorm–Dropout stacks; generator: 256→512→1024 units; discriminator: 1024→512→256 units; no convolutional/pooling layers in GAN; CNNs: standard Conv-BN-ReLU stacks,Not specified,No explicit cross-dataset generalization; only intra-dataset (training/test split) results; future work suggested on generalization,SSO is efficient and reduces computational time; method scalable to more subjects in same datasets; no discussion of very large datasets or high-res signals,Adam optimizer for GAN (explicit mention in GAN pseudocode); CNNs trained with SGDM (stochastic gradient descent with momentum),Explicit monitoring of generator and discriminator loss over 1000 iterations; batch normalization for regularization; training equilibrium observed after 250 steps,DWT and EMD enable extraction of discriminative time-frequency IMF and subband features; feature learning compared across methods; SSO optimizes extracted feature quality,,,,,,,,,,,,,
Intelligent System for Stability Assessment of Chest X-Ray Segmentation Using Generative Adversarial Network Model with Wavelet Transforms,"2024, El Mansouri et al.",Medical imaging – chest X-ray segmentation,Shenzhen Hospital (SH) dataset; COVID-19 Chest X-ray images and Lung masks Database,GAN with U-Net-based generator and ConvNet-based discriminator,"Discrete Wavelet Transform (DWT); applied in generator and discriminator, replacing pooling/upsampling layers","SH: Dice = 0.9685, COVID-19: Dice = 0.9906 (with no noise); GAN with DWT maintains high Dice at multiple noise ε (e.g., Dice 0.9635 at ε=0.2); IoU and Accuracy also used (exact values not specified)","Model outperforms traditional GAN in stability, accuracy, and efficiency for chest X-ray segmentation tasks; robustness to input noise demonstrated","Integration of wavelet transforms into GAN segmentation architecture to replace pooling/upsampling, leading to improved stability and robustness against noise",Evidence: Stable performance under increasing noise levels (GAN with DWT remains robust; traditional GAN performance collapses); tested on perturbed and original images; improvement shown in both datasets,"Limitations: Not specified explicitly, but mentions computational requirements, need for large annotated data, and does not test all possible imaging modalities","Adversarial loss; segmentation loss (likely Dice or Binary Cross-Entropy, exact not specified)",Supervised training,cGAN (conditional GAN),U-Net-based generator (with DWT layers); ConvNet discriminator (with DWT layers),DWT replaces max pooling and upsampling in both generator and discriminator (multi-scale edge features retained),"Compared with traditional GAN; GAN with DWT outperforms in accuracy, Dice coefficient, and stability under noise (Dice drop-off for traditional GAN at ε ≥ 0.1, stable for GAN with DWT)",512×512,Traditional GAN models without wavelet integration,"Encoder/decoder with Conv-BN-ReLU stacks in U-Net form; 5 layers each in encoder/decoder; DWT used to reduce downsampling loss, preserve edges; Discriminator: 5 layers, hidden and dropout layers, batch norm, max pooling replaced by DWT",Not specified,"Tested on two independent CXR datasets (SH, COVID-19 CXR); no external test sets beyond these","Discussed: DWT reduces computational loss via data preservation in downsampling; implementation on GPU P100; 200 epochs, batch size 3, handles large resolution images; scalability to more datasets implied but not tested","Adam optimizer; learning rate 0.0003, decay 0.5",Training stable for model with DWT; model robustness evidenced by stable Dice under noise; use of batch norm and dropout layers,Model learns multi-scale edge features via wavelet transform; wavelet features used as input to improve segmentation stability and accuracy,,,,,,,,,,,,,
L-WaveBlock: A Novel Feature Extractor Leveraging Wavelets for Generative Adversarial Networks,"2023, Shah et al.","Image-to-image translation, Resolution enhancement, Denoising","Maps (road satellite/map, 512x512, 1096 train/test); CelebA (202,599 faces, 218x178); GoPro (deblurring, 1280x720, 2,103 train, 1,111 test)",UNet-based GAN generator; special skip connection with DWT (Daubechies 2),"Discrete Wavelet Transform (DWT) with Daubechies 2 wavelet, applied in skip connections of generator (at each skip connection between encoder and decoder)","Maps: IS=3.6959, SSIM=0.4261 (w/ L-WaveBlock); CelebA: PSNR=29.05, SSIM=0.874 (w/ L-WaveBlock); GoPro: PSNR=26.913, SSIM=0.782 (w/ L-WaveBlock); baseline values provided",Accelerated convergence; competitive or improved image quality vs. baseline on diverse tasks; model efficiently extracts features and speeds up GAN training.,"Introduction of L-WaveBlock: a DWT-powered feature extraction module in GAN generators using adaptive band-wise convolution in skip connections, leading to faster convergence and efficient multi-scale representation.","Demonstrates faster convergence (needs ~750 epochs vs. 1000 baseline), stable loss, competent performance across multiple datasets and tasks; reduction in memory/processing needs noted.","Not always state-of-the-art in denoising quality (GoPro dataset), some results only slightly better; scalability to massive datasets or high-res not exhaustively benchmarked; future work suggested.","Adversarial loss (GAN); for super-resolution, pixel-wise and SSIM; loss curves for generator shown; stability and smooth convergence with L-WaveBlock.","Supervised (paired datasets: maps, CelebA, GoPro); paired image training.","Standard GAN (not explicitly cGAN, WGAN, etc.)",UNet-based generator with DWT-integrated skip connections; discriminator not exhaustively detailed (standard design assumed),DWT applied at each skip connection in generator (encoder-decoder UNet structure); each skip processed band-wise and recombined,"Comparison to baseline/vanilla GANs (without L-WaveBlock) on all tasks: IS, SSIM, PSNR all improved or competitive; ablation: with and without L-WaveBlock.",Maps: 512x512; CelebA: 218x178; GoPro: 1280x720,Baselines: UNet-based GAN generator without L-WaveBlock (no DWT) for each task,"Conv-BN-ReLU stacks in encoder; L-WaveBlock custom skip with (for LL: 2 conv layers, for LH/HL/HH: 1 conv layer each) + concat; decoder mirrors encoder; batchnorm/residual/transpose conv mentioned",Not specified,"Applied to three different datasets (maps, CelebA, GoPro); generalizes across image translation, denoising, super-resolution tasks; no explicit cross-dataset transfer test",Model is lighter (less memory/processing via DWT); decomposes features at each scale; reduces overfitting potential; not highly detailed on scalability to very high-res/datasets,Not specified (optimizer),Stable training; rapid convergence especially with L-WaveBlock; smoothed loss curves vs. vanilla (graphs shown); no drastic divergence,Band-wise frequency-domain features extracted at skip connections; leverages multi-scale/orthogonal frequency subbands via DWT; enhances both local and global feature extraction,,,,,,,,,,,,,
MRI Super-Resolution using Generative Adversarial Network and Discrete Wavelet Transform,"2022, Balasubramanian et al.","Medical imaging, super-resolution reconstruction","2500 MRI images (mixture of tumor, Alzheimer affected, and normal MRI’s)",SRGAN (Super-Resolution GAN) with wavelet integration,2D Discrete Wavelet Transform (DWT) applied to input images; sub-bands passed through separate generators; inverse DWT combines outputs,PSNR: 29.44 dB; SSIM: 0.92,"Achieves high-resolution MRI images with improved edge clarity and frequency details, on par or better than standard SR techniques",Integration of DWT with SRGAN using separate generators per sub-band for enhanced feature extraction and image quality,Demonstrated computational simplicity and stable convergence; performance evaluated on a diverse MRI set; robustness discussed in terms of loss curves and feature representation,Limited to MRI images; cross-dataset generalization not tested; does not explicitly address scalability to larger datasets or higher resolutions,"Perceptual loss (VGG loss), adversarial loss, and wavelet loss; wavelet loss for sub-band reconstruction; regularization via weight decay","Supervised training (paired LR-HR MRI images, bicubic LR generation)",cGAN (conditional GAN) structure following SRGAN principles,Generator: 16 residual blocks (VGG-like per sub-band generator); Discriminator: 8 convolutional blocks with doubling kernels (64-512),Wavelet transform at input (preprocessing); IDWT after sub-band generators before discriminator,Compared to SRGAN; authors mention competitive or improved PSNR and SSIM values vs state-of-the-art; qualitative and loss curve comparisons shown,256x256 (HR images and network input),"SRGAN, standard super-resolution GAN architectures",Generators: Residual blocks; Discriminator: Conv blocks with increasing depth; VGG-type feature extractors; Conv-BN-ReLU stacks,Not specified,Not specified,Model claimed efficient and computationally simple; no explicit scalability tests discussed,"Adam optimizer (inferred from standard practice), learning rate=0.0002, batch size=32, 100 iterations",Loss curve shows stable training and convergence; weight decay used as regularization; decrease in loss with iterations shown,Wavelet coefficients (sub-band features) extracted and processed; VGG feature maps used for perceptual loss; designed for enhanced frequency and edge representation,,,,,,,,,,,,,
