Title,Year & Authors,Application Domain,Dataset,Architecture,Wavelet / Pooling Technique,Quantitative Results,Outcomes,Main Contribution / Innovation,Model Robustness,Limitations,Loss Function,Training Strategy,GAN Variant,Discriminator / Generator Type,Pooling Layer / Wavelet Location,Comparative Analysis,Input Size / Resolution,Baseline for Comparison,Layer Composition,Code Availability,Cross-Dataset Generalization,Complexity and Scalability,Optimization Algorithms,Training Dynamics / Regularization / Convergence,Feature Representation / Extraction,,,,,,,,,,,,,
Super-Resolution Image Reconstruction Method between Sentinel-2 and Gaofen-2 Based on Cascaded Generative Adversarial Networks,"2024, Wang et al.",Super-resolution of remote sensing images; cross-sensor super-resolution,"GF_Sen (new: paired Sentinel-2 and Gaofen-2), plus UC_Merced, WHU-RS19, USC-SIPI for evaluation",CSWGAN (Cascade of Self-attention GAN (SGAN) and Wavelet-based GAN (WGAN)),"Wavelet transform; wavelet prediction and reconstruction subnet in WGAN, parallel sub-nets predicting wavelet coefficients (1-level decomposition)","On GF_Sen: PSNR = 24.335, SSIM = 0.828; Outperforms ESRGAN by PSNR +4.877, SSIM +0.181; Also reported: SAM = 0.178, RMSE = 15.356 (see Table 3)","CSWGAN achieves superior SR with improved high-frequency detail, best PSNR/SSIM on real cross-sensor data, robust on texture-rich scenes; edge contours clearer and less aliasing versus baselines","Cascaded architecture combining spatial and frequency domain generators (SGAN, WGAN); first in remote sensing to couple self-attention and wavelet features for SR; new real high–low-res cross-sensor dataset (GF_Sen)","Demonstrates strong generalization: trained on GF_Sen outperforms simulated data, robust on multi-scene and cross-dataset scenarios; best results on high-frequency scenes and large scales","Limitations noted for extension to multi-band (beyond RGB), handling of large resolution gaps (future work: more bands, extreme upscaling, spatiotemporal fusion); code/data delayed by patent application; extra training needed for sensors with larger resolution gaps","SGAN: Lmse (pixel-wise MSE) + α1*Ladv (adversarial) + α2*Ltv (TV reg.), WGAN: Lwavelet (wavelet coeff. MSE) + β*Ltexture + Lfull-image (MSE); α1=1e-3, α2=2e-8, β=0.1","Supervised training; two-phase strategy: SGAN then WGAN, joint end-to-end tuning at end; pretraining on UC_Merced, then on GF_Sen, batch size 16, learning rate scheduling, 1600 epochs","cGAN (conditional adversarial), overall framework utilizes adversarial loss in both components","Generator: residual blocks w/ PReLU + self-attention (SGAN), wavelet prediction/reconstruction subnets (WGAN); Discriminator: LeakyReLU-activated, no max pooling; details inspired by SRGAN/ESRGAN",Wavelet applied after SGAN output: WGAN processes spatial domain output from SGAN and predicts wavelet coefficients for HR synthesis; self-attention branch outside SGAN residual blocks,"Extensive: compared against Bicubic, SRCNN, ESPCN, ESRT, SRGAN, ESRGAN on multiple datasets and scenes; CSWGAN superior in PSNR/SSIM, esp. for texture/edge recovery; example: +4.877 PSNR vs ESRGAN","HR: 128x128 (cropped), LR: 64x64 (cropped); also 256x256, 512x512, 1024x1024 for USC-SIPI","SRCNN, ESPCN, ESRT, SRGAN, ESRGAN, Bicubic interpolation; scene-based: light-weight CNNs, transformer, GANs",Conv + BatchNorm + ReLU/PReLU stacks; residual blocks in generator; 1x1 convs for attention; WGAN has multiple parallel subnets for wavelet decomposition/reconstruction; deconvolution for upsampling,Not specified (dataset/code under patent application; intention to share),"Yes: tested on WHU-RS19, USC-SIPI after training on GF_Sen; cross-sensor and synthetic-real transfer tested",Not deeply discussed; cascading increases compute needs; end-to-end fine-tuning and progressive learning help; larger images require more resources,Adam optimizer (implied by deep learning conventions; not explicitly stated but consistent with similar literature),"Training split into SGAN then WGAN, with learning rate decay; joint end-to-end fine-tuning at end; TV regularization for smoothing; separate adversarial systems before integration; robust losses help convergence","Features: Self-attention (global), spatial low-frequency and geometric info (SGAN); wavelet-based frequency/texture detail extraction (WGAN); preserves more high-frequency info for realistic textures",,,,,,,,,,,,,
Super-resolution imaging quality enhancement method for distributed array infrared camera,"2024, Song et al.",Infrared image super-resolution imaging and enhancement,"Custom dataset created from 4-camera distributed array infrared imaging system (with augmentation: flipping, mirroring; ~6380 images); test chart and complex paper-cut images",Real-ESRGAN combined with POCS (Projections onto Convex Sets),"Wavelet fusion for preprocessing/denoising (wavelet transform, fusion rules in low/high frequencies)","Resolution improved to 2.5198 lp/mm (from 1.5874), MTF increased by 1.2×, entropy +18.87%, std +13.51%, NIQE −18.87% (to 4.5425); output image up to 5120×4096 px","Model substantially enhances super-resolution and detail in distributed infrared camera images, increasing clarity, contrast, and information content while reducing noise and artifacts","Integration of wavelet fusion, POCS, and Real-ESRGAN for noise reduction and robust super-resolution from unaligned distributed arrays; two-stage training with high-order degradation modeling",Tested on multiple targets and varied camera layouts; performance consistently superior to single-camera; robustness to camera spatial arrangement and input noise discussed,"Limitations include data/code availability (no public datasets), requirement for registration/motion compensation, and windowed laboratory demonstration (not full real-world scenarios); future work needed for real-time or field deployment","L1 loss (stage 1), combined L1, perceptual loss (VGG-based), and GAN loss (stage 2)","Supervised training with two-stage strategy: initial L1, then adversarial + perceptual",cGAN (Real-ESRGAN),"U-Net discriminator with spectral normalization, generator based on Residual-in-Residual Dense Blocks (RRDB)","Wavelet fusion/transform in image preprocessing, before POCS and GAN; no pooling in GAN detailed","Extensive comparisons: single-camera, POCS only, POCS+Real-ESRGAN; ablation on components like pre- and post-processing; POCS+Real-ESRGAN always best",Input 640×512 (initial) up to 5120×4096 (super-resolved); other examples: 225×266 to 1800×2128 px,"Baselines: single infrared camera, POCS only (without GAN), initial (low-res) images",Wavelet fusion for input denoising; GAN generator: RRDB/Conv/Pixel shuffle; discriminator: Conv/Spectral Norm/U-Net; standard Conv-BN-ReLU/residual stacks,Not specified,No explicit cross-dataset generalization; only test chart plus several objects in lab; transfer to field discussed as future work,"Efficiency and cost improvement by distributed (non-aligned) array; no explicit runtime/scalability results, but handles 4–1800+ px images; not benchmarked for speed","Adam optimizer (implied by typical Real-ESRGAN, not named explicitly)",Discriminator uses spectral normalization for stability; two-stage training improves convergence; generator initialized with PSNR-optimized weights,"Wavelet-based preprocessing extracts low/high frequency details; POCS registration extracts motion/residual features; Real-ESRGAN learns visually plausible, detail-preserving super-res representations",,,,,,,,,,,,,
"Super-resolution of very low-resolution face images with a wavelet integrated, identity preserving, adversarial network","2022, Dastmalchi et al.",Face hallucination / super-resolution of very low-resolution face images,"CelebA (training and testing), LFW (face verification/generalization), Helen (evaluation)","Custom GAN-based with residual modules and transposed convolution; Baseline Net, IPA, and WIPA extensions",Wavelet: Haar wavelet; Wavelet Prediction blocks attached after each residual module to predict and integrate wavelet-enriched features at multiple scales,"PSNR: 25.16 dB (CelebA, 8X); Verification rate: 86.1% (LFW, 8X); FID: 14.69 (CelebA 8X); NIQE: 4.12 (CelebA 8X); SSIM: 0.82 (CelebA 8X); See Tables 4-8 for additional datasets/scales","Achieved state-of-the-art perceptual and quantitative results on multiple datasets for severe upscaling; produces high-quality, identity-consistent, and sharp face images from very low-res inputs","Proposed a Wavelet-Integrated, Identity-Preserving Adversarial (WIPA) network with Wavelet Prediction blocks and novel combined loss, maintaining both perceptual quality and identity at extreme magnification factors","Demonstrates high-quality, identity-consistent results across diverse datasets (CelebA, LFW, Helen); maintains performance at 8X/16X; ablation study and generalization to unseen datasets","Execution speed is lower than fastest baselines (e.g., EIPNET); does not achieve top LFW verification rate; wavelet embedding does not improve identity verification rate; future work includes exploring discriminators, curvelet transforms, or parallel pipelines","Pixel-wise MSE/content loss, perceptual loss (VGG-19-based), adversarial loss (GAN), identity loss (SphereFace/cosine), wavelet prediction loss (L1/MAE); aggregated with empirically set weights",Supervised training with GAN adversarial framework; losses aggregated; ablation on supervised components,cGAN (conditional GAN),"Generator: Residual-based network with wavelet blocks; Discriminator: 5-layer ConvNet (see Table 1), Sigmoid final output",Wavelet/Pooling applied after each residual module (encoder/generator trunk); concatenation with original feature maps per scale,"Compared to: SR-LRFR, URDGN, WaveletSrNet, SRGAN, SrResNet, EIPNET for PSNR, SSIM, FID, NIQE, and verification; ablation studies on loss and architecture; WIPA outperforms all baselines on most metrics",Input: 16×16 (8X) or 8×8 (16X) low-res; output: 128×128,"SR-LRFR, URDGN, WaveletSrNet, SRGAN, SrResNet, EIPNET, Baseline Net, IPA, Bicubic (see Tables 5-6)","Conv-BN-LReLU stacks; Residual blocks in modules; 4x4 transposed convolutions for upscaling; Wavelet Prediction: 3x3 conv + 1x1 conv per block; Discriminator: 4x4 conv with increasing channels, 8x8 final conv, FC Sigmoid",Not specified,Tested on LFW and Helen after CelebA training; demonstrates good cross-dataset generalization,"Run-time: 125 FPS (8X), 75 FPS (16X); higher network depth/layers for stronger upscaling reduces speed; more efficient than some wavelet methods but slower than EIPNET","Adam optimizer (lr=1e-4, β1=0.5, β2=0.999, lr decay by 0.5 every 40 epochs)","BatchNorm, LReLU activations, learning rate decay; aggregation of multiple regularization losses; stable convergence shown in experiments",Wavelet-enriched feature extraction at multiple scales; VGG-based semantic features (perceptual loss); SphereFace identity features; explicit prediction and integration of frequency-domain (wavelet) features,,,,,,,,,,,,,
Super-resolution Reconstruction Algorithms Based on Fusion of Deep Learning Mechanism and Wavelet,"2022, Zhang et al.",Super-resolution reconstruction (image SR),"VOC2012 (training), Set5, Set14, BSD100, Urban100 (testing)",SRGAN with architectural modifications (Wavelet-SRGAN)," ""Wavelet packet transform (Haar wavelet)"," used to decompose images into high- and low-frequency components for coefficient prediction"""," ""PSNR (Set5: 30.63", Set14: 27.04, BSD100: 26.91, Urban100: 24.12); SSIM (Set5: 0.897, Set14: 0.770, BSD100: 0.728, Urban100: 0.743); FSIM (Set5: 0.929, Set14: 0.899, BSD100: 0.832, Urban100: 0.957); UIQ (Set5: 0.935, Set14: 0.978, BSD100: 0.984," Urban100: 0.967)""","Outperforms SRGAN in objective metrics (PSNR, SSIM, FSIM) and produces visually sharper, more natural reconstructed high-res images with better texture restoration.","First integration of wavelet packet transform with GAN for SR; predicts wavelet coefficients using network, improving texture and objective scores; removes BN from residual blocks and uses PReLU.",Demonstrates improved quantitative and qualitative results vs SRGAN across multiple datasets. Discusses using several diverse datasets for both training and testing.,Does not discuss real-time performance or visual artifacts in all edge cases; only 4× upscaling factor and some results dataset-specific; no extensive analysis on robustness to extreme degradation or generalization to unseen domains.,"Adversarial loss, perceptual loss (content loss with VGG19 features), MSE, and wavelet coefficient prediction loss (combined as a weighted sum).","Supervised (paired LR-HR images, ground-truth HR used in training).","SRGAN (conditional GAN), Wavelet-SRGAN (custom variant).","Generator: modified residual block net with residual connections, PReLU, no BN; Discriminator: standard adversarial net (architecture details not fully specified).","Wavelet packet decomposition applied in generator, for learning and predicting high- and low-frequency coefficient components.","Compares with SRGAN baseline using the same dataset and evaluation metrics; consistently outperforms with higher PSNR, SSIM, FSIM, and UIQ.","88×88 HR crops during training; 4× upsampled images in testing (input/output resolution up to 352×352, but not explicitly stated for all sets).","SRGAN, bicubic interpolation, traditional SR deep nets (SRCNN reference), but main comparison is SRGAN.","Convolutional layers (3×3), modified residual blocks (no BN, uses PReLU), skip connections every two conv layers except the first, stacked in generator; fixed channel widths per layer.",Not specified,"Tested on multiple datasets (Set5, Set14, BSD100, Urban100) beyond training set (VOC2012), suggesting some evidence of cross-dataset generalization.","Some discussion of memory efficiency (from no BN); not deeply analyzed for scaling to ultra-high-res or very large datasets; batch of 16, learning rate 0.0002.","Adam optimizer (details: learning rate 0.0002, batch size 16, 313,200 iterations).",Reports higher stability from residual net without BN; no mention of regularization or failed convergences.,"Learns to predict wavelet coefficients, infers both high- and low-frequency wavelet features for finer texture, uses VGG19-feature-based perceptual map in loss function."
Super-Resolution reconstruction method of remote sensing image based on multi-feature fusion,"2020, Huang et al.",Remote sensing image super-resolution,"DOTA, RSOD, UCAS",SRGAN-based custom architecture,Haar wavelet transform; wavelet coefficients decomposed from input and fed to parallel subnets in the generator,"PSNR (DOTA x2): 36.722; SSIM (DOTA x2): 0.965; FSIM (DOTA x2): 0.926; UIQ (DOTA x2): 0.965; Results consistently higher than Bicubic, SRCNN, SRGAN across datasets and scales","Improved quantitative and visual quality of reconstructed images, especially in texture and fidelity, outperforming prior methods on standard remote sensing datasets",Integration of wavelet transform into SRGAN by decomposing input into wavelet subbands and training them in parallel subnetworks; custom loss combining perceptual and wavelet coefficient losses,"Demonstrates superior performance and stability on three datasets and across multiple upscaling factors (2x, 3x, 4x) with consistent quality improvement over baselines",Potentially limited generalizability outside remote sensing data; test results mainly on three labeled datasets; future work may explore further general case applications,"Perceptual loss (feature loss), adversarial loss, and wavelet coefficient loss (minimum mean square error for wavelet decomposition coefficients)",Supervised,cGAN/SRGAN-like,"Discriminator: Dense blocks with PReLU and Sigmoid; Generator: four functional modules—edge extraction (Laplacian filter + 3x3 conv), residual dense learning, edge enhancement, and pixel shuffle upsampling",Wavelet transform on generator input; four wavelet coefficient subbands each processed by independent subnet; merges via deconvolution; applied early in generator,"Comprehensive ablation: compared against Bicubic, SRCNN, SRGAN; consistently higher metrics (see PSNR, SSIM, FSIM, UIQ tables); qualitative examples provided","Not specified; typical remote sensing images (DOTA: ~1024×1024, RSOD/UCAS <1000×1000); upscaling at factors 2, 3, 4","Bicubic, SRCNN, SRGAN","Edge extraction via Laplacian+Conv, Residual Dense Blocks, Pixel Shuffle, Dense Blocks in Discriminator, Deconv merging for wavelet fusion",Not specified,Not specified,"Briefly discusses stable performance across three remote sensing datasets and scales, but no explicit cross-dataset (outside remote sensing) evaluation","No detailed computational complexity analysis; handles high-res satellite images and three datasets at several scales, implying reasonable scalability","Not specified (common in GAN literature: likely Adam, but not detailed)","Dense connections, residual dense blocks, local feature fusion help stable training, as evidenced by improved metrics; add wavelet loss for regularization; no explicit report of instability",Inputs feature images processed as wavelet coefficients in parallel streams; generator extracts edge (spatial) and frequency domain (wavelet) features for multi-resolution analysis,,,,,,,,,,,,
Superpixel conditional generation adversarial network for CMR artifact correction,"2024, Zhu et al.",Cardiac magnetic resonance imaging motion artifact removal,"Synthetic CMR dataset produced (9276 images from 52 cases, artifact-free and artifact-added pairs); GoPro dataset (comparative); Department of Medical Radiology, Affiliated Hospital of Hebei University",spcGAN (superpixel conditional GAN) based on cGAN,"Superpixel pooling (average pooling on superpixel blocks via U-FCN-based segmentation applied in generator and discriminator), inverse pooling","PSNR up to 30.235, SSIM up to 0.873, Tenengrad up to 0.474 on synthetic CMR test set; outperforming baselines","Proposed spcGAN effectively removes motion artifacts from CMR images, achieving sharper edges, clearer details, and higher scores than existing methods; robust performance on synthetic and real images",Introduction of superpixel pooling and segmentation at generator/discriminator; dual discriminator architecture (PatchGAN + superpixel discriminator); comprehensive hybrid loss incorporating superpixel and edge loss,Strong ablation and comparative results; model robust to details/noise via superpixel pooling; method works well for real and synthetic artifacts; tested on several scenarios,"Long computation/training time due to superpixel operations; only effective for CMR motion artifacts, not other artifact types (metal/magnetization); dataset used is confidential; future work to streamline network","Hybrid loss: adversarial loss, superpixel pooling loss, segmentation loss (cross-entropy), edge loss, perceptual loss (L2); specifically, LG=0.43*Lsp+0.17*Lseg+0.05*Ledge+0.11*Ladv+0.26*L2",Supervised training (artifact/clean pairs),Conditional GAN (cGAN),"Dual discriminator: PatchGAN (convolutional) + Superpixel Discriminator (VGG-16 feature extractor with superpixel pooling); Generator: U-FCN superpixel segmentation, FPN-Inception feature fusion, Conv/Deconv stacks","Pooling and wavelet: Average superpixel pooling in both generator and discriminator (after segmentation, before decoding); inverse pooling restores features post-pooling","Compared to Multi-Scale Network, DeblurGAN-v2, SRN-Deblur, DRN-DCMBGAN, RCAN; achieves highest PSNR, SSIM, and Tenengrad scores; extensive ablation on generator/discriminator/loss presence; clear outperformance",Not explicitly specified; images preprocessed to 1/n of original for superpixel segmentation; typical MR image size assumed (~256×256 or similar),"Baselines: Multi-Scale Network, DeblurGAN-v2, SRN-Deblur, DRN-DCMBGAN, RCAN; also ablations (w/o superpixel pooling, dual discrim, hybrid loss)",U-FCN: 10 conv layers + 9 deconv (ReLU); jump connections; FPN-Inception multi-scale fusion; VGG-16 feature extraction for superpixel discriminator; PatchGAN in dual discriminator,Not specified,"Some cross-dataset evaluation (GoPro, synthetic, clinical CMR data); synthetic artifacts evaluated against real clinical artifacts",Current method is computationally slow due to segmentation and pooling; pretraining segmentation network reduces time; decreases with fewer superpixels; acknowledged as an area for improvement,"Adam optimizer; learning rate 1e-5 for 100 epochs, decayed to 5e-5 over next 100 epochs; Pytorch implementation; pre-trained backbones frozen/unfrozen during training",Training found stable; hybrid loss and dual discriminator improve convergence; weights for loss/discriminators found via 30 groups of experiments; pretraining of segmentation stabilizes and accelerates learning,Explicit discussion of superpixel and edge feature learning at generator and discriminator; combines high-res/semantic info via FPN-Inception; superpixel segmentation/coding guides local and global feature extraction,,,,,,,,,,,,,
Tool wear prediction in face milling of stainless steel using singular generative adversarial network and LSTM deep learning models,"2022, Shah et al.",Tool condition monitoring (TCM) for tool wear prediction in face milling of stainless steel,"Prognostics Centre of Excellence-Data Repository, NASA milling dataset",SinGAN (Singular GAN); LSTM models for prediction,Morlet wavelet (for scalogram generation); applied to convert AE and vibration sensor signals to images; RWE used for mother wavelet selection,"Lowest MAE: 0.005, RMSE: 0.016, MSE: 0.0002, R² and Adj. R²: 0.997 (vibration signals, stacked LSTM); AE signals: testing MAE 0.008, RMSE 0.023, MSE 0.0005, R² and Adj. R²: 0.995",Stacked LSTM with SinGAN-augmented wavelet scalogram features enables highly accurate prediction of tool wear with scarce experimental data,"Combined use of SinGAN for data augmentation, Morlet wavelet-based scalograms, and various LSTM architectures for robust, data-efficient tool wear prediction","Stacked LSTM outperforms vanilla and bidirectional LSTM, showing high prediction accuracy and low error metrics both in training and testing; robust transformation reduces bias from outliers","Potentially limited by the need for feature robustness, dependency on the relevance of image quality parameters, and only tested on certain datasets; code/data not publicly available; application to other settings not explored; future work could address broader validation","Adversarial loss (SinGAN); performance metrics for regression (MSE, MAE, RMSE, R², Adj. R²); robust scalar transformation for features; no custom loss for LSTM specified","Supervised (for LSTM prediction); Unsupervised (SinGAN data augmentation); data split: 70% training, 30% testing",SinGAN,Not specified for SinGAN; LSTM generator is standard; no special GAN discriminator discussed,Morlet Wavelet Transform applied during feature extraction (signal preprocessing to produce input scalograms); not in network layers themselves,"Yes: Comparative results with literature (e.g., vanilla vs. stacked vs. bidirectional LSTM), and with prior models on same dataset; stacked LSTM superior (MAE 0.005, RMSE 0.016, MSE 0.0002, R² 0.997)","Not explicitly specified; input scalograms and features from 14,500 AE and 14,500 vibration images; original signals correspond to particular machine and signal settings; implied high-resolution feature matrices","Baseline models from literature: ANFIS, CNN, logistic regression, decision forest, hybrid LSTM, KELM, etc.; within-study: vanilla and bidirectional LSTM","Standard LSTM layers and robust scalar feature preprocessing; no custom block details specified; SinGAN as a multi-scale unconditional GAN; LSTM: vanilla, stacked, bidirectional versions",Not specified,Not discussed; cross-dataset tests not reported,Discussion on computational cost of GAN data augmentation and feasibility for scarce data scenarios; not focused on scaling to larger datasets or images,"Not specified; likely Adam or similar for deep learning, but not explicitly mentioned",Robust scalar feature transformation for stability; LSTM training shown to converge; SinGAN used to mitigate overfitting due to small data; no regularization details,"Feature extraction uses Morlet wavelet scalograms from sensor signals; 14 image quality parameters (e.g., SSIM, PSNR, MSE, RMSE, ERGAS, VIF) compiled as feature vectors for LSTM prediction",,,,,,,,,,,,,
