Title,Year & Authors,Application Domain,Dataset,Architecture,Wavelet / Pooling Technique,Quantitative Results,Outcomes,Main Contribution / Innovation,Model Robustness,Limitations,Loss Function,Training Strategy,GAN Variant,Discriminator / Generator Type,Pooling Layer / Wavelet Location,Comparative Analysis,Input Size / Resolution,Baseline for Comparison,Layer Composition,Code Availability,Cross-Dataset Generalization,Complexity and Scalability,Optimization Algorithms,Training Dynamics / Regularization / Convergence,Feature Representation / Extraction,,,,,,,,,,,,,
Multimodal-Boost: Multimodal Medical Image Super-Resolution using Multi-Attention Network with Wavelet Transform,"2021, Dharejo et al.",Medical imaging super-resolution (single-image super-resolution for diverse medical images),"DIV2K (for pre-training), Shenzhen Hospital CT images, Montgomery County X-ray, Teeth, Knee, and Calgary Campinas MRI Brain Scans",GAN with Multi-Attention and Upsample Blocks (referred to as Multimodal-Boost),2D discrete wavelet transform (DWT) from Haar family for input decomposition; 2D inverse DWT (IDWT) for HR image reconstruction. Applied at input and output of generator.,"PSNR: Teeth 36.32, Knee 36.97, Brain 37.46; SSIM: Teeth 0.937, Knee 0.931, Brain 0.941","Outperformed existing methods in PSNR/SSIM, produced perceptually realistic SR with improved edge and texture details for multiple medical modalities.",First multi-attention GAN framework combined with wavelet transform for multimodal medical SR; integrates transfer learning and a domain-specific perceptual loss.,Demonstrates robustness via successful transfer learning to multiple modalities and datasets; effective generalization confirmed in comparisons and cross-modality testing.,Model has higher parameter count and slower training compared to some lightweight baselines; does not yet address real-time speed or parameter minimization; future work needed for parameter reduction and impact on downstream tasks like classification.,"Wasserstein GAN (WGAN) loss, perceptual loss (with VGG-16-based and domain-specific perceptual networks)","Transfer learning: pre-trained on DIV2K (natural images), fine-tuned on smaller medical datasets; training is supervised with paired data.",WGAN,"Generator: Multi-attention blocks + upsample-attention blocks (custom CNN design); Discriminator: CNN-based, binary classifier (local/global not specified)",DWT applied at input (encoder/start) for wavelet subbands and IDWT at end of generator; pooling (max pool) present in perceptual loss network; attention/upsample blocks within main generator.,"Compared to SRCNN, EDSR, Meta-SR, CIRCLE-GAN, SR-ILLNN, and Bicubic interpolation; consistently achieves best PSNR/SSIM in all tested modalities.",Training patch size: 56×56 (DIV2K); evaluation: all images resized to 512×512; original DIV2K images are up to 2000×1400,"SRCNN, EDSR, Meta-SR, CIRCLE-GAN, SR-ILLNN, Bicubic interpolation","Generator: Conv-BN-LReLU stacks, self-attention blocks, upsample-attention blocks, upsample layers; Perceptual network: Conv layers, max pool, ReLU; total structure includes DWT/IDWT transforms.",Not specified,"Yes; tested on both natural (DIV2K) and multiple medical datasets (CT, MRI across modalities)","Model has more parameters and slower training/inference compared to SRCNN, Meta-SR, SR-ILLNN, but fewer than EDSR and CIRCLE-GAN; further work suggested on model compression; scalable due to transfer learning across domains.","Adam optimizer (β1=0.9, β2=0.999, ε=10⁻⁸)",WGAN-based losses converge faster; loss curves suggest high training stability and rapid convergence; regularization via gradient penalty in WGAN; improved convergence speed with combined perceptual+adversarial loss.,"Wavelet subbands (multi-frequency), self-attention features, upsample-attention maps, perceptual features extracted via domain-specific VGG-16; focus on texture, edge, and high-frequency details.",,,,,,,,,,,,,
Multiscale Generative Adversarial Network Based on Wavelet Feature Learning for SAR-to-Optical Image Translation,"2022, Li et al.","SAR-to-optical image translation (remote sensing, image synthesis)",Sentinel-1 (SAR) and Sentinel-2 (optical) datasets; also QXS-SAROPT ship dataset for extension,WFLM-GAN (Multiscale GAN based on wavelet feature learning),Haar wavelet transform; applied for decomposing optical images into low-frequency (content) and high-frequency (detail) features in generator (content learning stage),"Best results on fall dataset: SSIM 88.921%, PSNR 26.345, FID 50.396, KID 0.305; outperforms baselines on all datasets with highest SSIM/PSNR and lowest FID/KID","Achieved superior SAR-to-optical translation quality with improved details and realism, robust across seasons and regions; enables enhanced visual interpretation for nonexperts.",Two-stage generator: learns SAR-to-wavelet feature mapping then reconstructs gray-scale/optical image; integrates multiscale coloring network (detail+style learning); novel multitask discriminator for joint real/wavelet/gray-scale discrimination; introduces EDGE and SSIM loss for enhanced structure/texture.,"Demonstrated stable and consistent improvements in various regions/seasons; ablation/expansion studies show effectiveness & generalization, including to unseen ship targets; analysis on data partitioning and histograms supports stability.","Smallest quantitative improvement on homogeneous, low-detail datasets (e.g., winter set); generalization can drop if data distribution in test split is very different; use of only Haar wavelet; further improvement needed for lightweight/faster models.","Adversarial (LSGAN/least-squares), L1 and L2 supervised loss, EDGE loss, SSIM loss, identity loss",Supervised training (paired SAR-optical images),LSGAN (least-squares GAN); cGAN-like supervised structure,"Multitask discriminator (Markovian/Patch-like for gray-scale/color and spliced wavelet features) / Generators: first stage is wavelet-feature-to-gray multiscale residual net, second is multiscale coloring network with detail/style branches",Haar wavelet transform is applied in generator during content learning (first stage); detail learning branch in second-stage generator; pooling occurs via downsampling/upsampling in multiscale residual modules,"Compared with Pix2Pix, Pix2PixHD, S-CycleGAN, CycleGAN, and ablations; consistently outperformed in SSIM, PSNR, FID, KID; ablation validates contribution of each architectural component/loss function.",256×256,"Pix2Pix, Pix2PixHD, CycleGAN, S-CycleGAN","Residual blocks, downsampling/upsampling modules, multiscale feature fusion, Conv-BN-ReLU, Leaky/ReLU activations, multiscale residual structures in both generator and discriminator",https://github.com/G2022G/WFLM-GAN,"Yes; tested on QXS-SAROPT ship dataset (trained on main dataset, transfers to specific target imagery); analyzes cross-region/season splits.","Noted that parameter/compute increase is less than best baseline (Pix2PixHD), 1.27x params for ~1.7-1.8x improvement on main metrics; scalability to larger/more diverse SAR/optical scenes implied but not benchmarked for ultra-high res.","Adam optimizer (lr=0.0002, β1=0.5, β2=0.999), batch size 1, 200 epochs","Least-squares loss improves training stability; multiscale design and extra losses (EDGE, SSIM, identity) help convergence/stability; ablations show more stable/consistent FID-KID curves with full model.",Explicit learning and supervision of low- and high-frequency (detail) wavelet features from optical images; multiscale residual architecture enables semantic/style/structure extraction at multiple levels; EDGE/SSIM losses guide texture and structure learning.,,,,,,,,,,,,,
Pedestrian wind flow prediction using spatial-frequency generative adversarial network,"2023, Wang et al.",Pedestrian wind flow prediction,"1200 image pairs of residential cases in Beijing, China, simulated with Eddy3D/OpenFOAM; 1000 train/100 val/100 test","SFGAN (Spatial-Frequency GAN), based on U-Net generator and PatchGAN discriminator","Gaussian blur (spatial domain) and discrete wavelet transform (DWT, frequency domain); spatial decomposition via Gaussian kernel, frequency decomposition via 5-level DWT","Wind_MAE: 0.19397, Wind_RMSE: 0.28113, FID: 64.61 (SFGAN); 5.35% lower MAE, 6.52% lower RMSE, and 12.3% lower FID than Pix2pix; inference time per case: 10.35 ms",SFGAN significantly reduced errors in high-error intervals and improved performance in wake and building-surrounding regions; enhanced wind prediction for architectural design,"Introduces a novel spatial-frequency loss incorporating Gaussian blur and DWT, flexibly integrable with other models; jointly aligns predictions and ground truth in both spatial and frequency domains","Consistent performance improvement shown across quantitative, qualitative, and ablation results; model achieves high accuracy with minimal extra computational cost; slight increase in training/inference time vs. Pix2pix","Physical fluid laws are not explicitly considered; only tested on simulated residential layouts from Beijing; possible overfitting to local geometry; generalization to other domains/real"" data not validated""","Adversarial loss (GAN), L1 loss, spatial-frequency loss (combining spatial (GAU) and frequency (DWT) domain losses with weights α, β); λ=100, α=0.1, β=20000",Supervised (paired image-to-image translation),"Conditional GAN (cGAN, specifically Pix2Pix-based)","U-Net-based generator, PatchGAN discriminator; skip connections and dropout in decoder",Pooling/wavelet: Gaussian blur applied in spatial domain decomposition (to predicted and ground truth images); DWT applied in frequency domain decomposition; both before loss calculation (not in main generator architecture),"Compared with Pix2pix, BicycleGAN, CycleGAN, CUT; SFGAN outperformed all baselines on all metrics; ablations showed best results using both spatial and frequency losses; addition of spatial-frequency loss improved other GAN variants (see Table 7)",256×256 pixels (each pixel = 2.5 m spatial extent),"Pix2pix, BicycleGAN, CycleGAN, CUT (state-of-the-art GANs for image translation and wind flow prediction)",Encoder: Conv-BN-LeakyReLU; Decoder: Deconv-BN-Dropout-ReLU; skip-connections; PatchGAN for discriminator; dropout in decoder; U-Net structure,Not specified,No (all data from the same dataset; cross-dataset performance not tested),"Slight increase in computation vs. Pix2pix; training and inference time comparable (10-11 ms/case, one epoch 334 s on single V100 GPU); efficiently supports rapid feedback for early design","Adam optimizer (β1=0.5, β2=0.999), initial LR 0.0002; 50 epochs constant LR + 50 epoch linear decay; batch size=1",Stable and smooth convergence; dropout and batchnorm mitigate overfitting; ablation studies confirm regularization and convergence behaviors; robust to large error intervals and critical regions,"Explicit learning and embedding of wind speed (low-component), sharp edges (high-component, spatial domain), and multi-level frequency spectrum (all DWT subbands); features enforce prediction-target similarity in both domains",,,,,,,,,,,,,
Power quality disturbances classification with imbalanced/insufficient samples based on WGAN-GP-SA and DCNN,"2024, Li et al.",Power quality disturbance classification,"Dataset A (imbalanced samples), Dataset B (small samples), simulated according to IEEE 1159 power quality testing standard",WGAN-GP-SA for data augmentation and DCNN for classification,Continuous Wavelet Transform (CWT) to generate time-frequency images; CWT applied after denoising as preprocessing,"SSIM (up to 0.979), PSNR (>20 for most classes), FID (as low as 19.69), Classification accuracy improved by 2.82% (93.09% over 90.27% in dataset A), and by 1.35% in dataset B (94.61%)",Method improved classification accuracy and generalization of the classifier for PQDs with imbalanced and insufficient samples; more balanced datasets led to best results,Integration of atrous spatial pyramid pooling (ASPP) module and Squeeze-and-Excitation (SE) block into WGAN-GP's discriminator (WGAN-GP-SA) for enhanced sample quality in data augmentation,Demonstrates improved stability (converging loss curves); better generalization and accuracy on both balanced and imbalanced test sets; t-SNE shows better class separability after augmentation,"Possible limitations in handling more complex, multiple PQDs; stated as future work",WGAN-GP loss with gradient penalty; classification uses cross-entropy loss for DCNN,Supervised,WGAN-GP-SA (an improved version of WGAN-GP),"DCNN classifier (7 Conv layers + 3 FC layers with Batch Normalization after each Conv); WGAN-GP-SA: multiple transposed conv layers (generator), Discriminator enhanced with ASPP-SE (SA) module",CWT applied after denoising as preprocessing (feature extraction stage); pooling layers present in DCNN; ASPP module embedded in the discriminator of WGAN-GP-SA,"Compared with DCGAN and WGAN-GP for data generation (FID: WGAN-GP-SA best); compared DCNN with AlexNet, VGG16, ResNet18, SqueezeNet (DCNN best); ablation on dataset size and balance; t-SNE visualizations; accuracy gains quantified",64×64 time-frequency images,"Baseline GAN models: DCGAN and WGAN-GP; baseline classifiers: AlexNet, VGG16, ResNet18, SqueezeNet",DCNN: 7 Conv-BN layers + 3 FC layers; generator uses multiple transposed conv layers; discriminator uses ASPP and SE modules; standard deep learning layer types,Not specified,No (the data used is confidential); no code repository mentioned,Not explicitly tested on external datasets; not specified,Discusses that the proposed model does not increase parameter count over baseline augmentation methods; computational scalability not explicitly addressed,"Adam optimizer (learning rates: 2e-5 for discriminator, 2e-4 for generator, 1e-4 for classifier); gradient penalty factor: 10",Loss curves show stable convergence for WGAN-GP-SA; t-SNE used for regularization visualization; Batch Normalization in DCNN,Wavelet (CWT) features extracted as 2D images for augmentation/model input; ASPP-SE in discriminator enhances multi-scale and channel-wise feature extraction,,,,,,,,,,,,
Remote sensing image dehazing using a wavelet-based generative adversarial networks,"2025, Chen et al.",Remote sensing image dehazing,"StateHaze1k, RICEx",GAN with dense residual wavelet architecture (custom),Wavelet transform blocks; applied in encoder and decoder to extract high and low-frequency features,"StateHaze1k thin: PSNR 28.204, SSIM 0.927; moderate: PSNR 30.643, SSIM 0.955; thick: PSNR 28.541, SSIM 0.929; RICEx: PSNR 35.212, SSIM 0.982","Achieves state-of-the-art PSNR and SSIM on multiple haze levels; restores color fidelity and detail, clearer dehazed images","Integration of dense residual blocks, wavelet transform blocks, and global/local attention blocks in a GAN for dehazing; improved loss combining LAB color and SSIM losses",Demonstrated superior and consistent performance across different haze densities and spatial resolutions; increased robustness via noise module in discriminator,"Longer inference time due to complexity; limited generalization to complex cases (e.g., clouds, snow, reflective surfaces); not optimal for complex remote sensing scenes","Adversarial loss, perceptual loss, LAB color loss, SSIM loss",Supervised,"GAN (standard, custom variant)","Discriminator with noise module; generator with encoder–decoder, dense residual, wavelet, and attention blocks",Wavelet transform applied in encoder and decoder hybrid modules to extract/fuse frequency features,"Compared with EPDN, MSGAN, DedustGAN, DW-GAN, PSMB; our method achieves highest PSNR and SSIM across all datasets; ablation shows each custom block's importance",512×512 (inference time reported for this size),"EPDN, MSGAN, DedustGAN, DW-GAN, PSMB","Conv-BN-LeakyReLU, residual blocks with dilated convolutions, dense residual blocks, wavelet blocks, attention blocks, PixelShuffle for upsampling",Code availability not explicitly stated; datasets and links provided,Tested on StateHaze1k and RICEx; strong performance on images with varying spatial resolutions,Model is more complex and has longer dehazing times; strong for varying image resolutions but complexity may limit scalability,"Adam optimizer (β1=0.9, β2=0.999)",Improved stability from BN and LeakyReLU; ablation shows individual block impact; robust to noise in discriminator,Dense residual blocks extract spatial features; wavelet blocks extract frequency-domain (high/low) features; attention enhances salient features,,,,,,,,,,,,,
Single image super resolution via wavelet transform fusion and SRFeat network,"2022, Ma et al.",Image super resolution,20-image custom dataset; some underwater images; random images from unspecified sources,SRFeat,Wavelet transform fusion; fusion of network output and up-sampled low-resolution image via wavelet transform,"PSNR improved by 0.3 dB; SSIM improved by 0.02; PSNR: up to 45.2440, SSIM: up to 0.9761; NIQE mean reduced by 0.1 compared to SRFeat","Enhanced image reconstruction with reduced noise, better recovery of global information, and higher PSNR/SSIM than baselines including SRFeat and SRCNN",Combines SRFeat deep network with wavelet transform-based image fusion post-process to improve denoising and global detail without added parameters/depth,Demonstrated improved performance across natural and underwater images; improved NIQE and robustness to image types,Fusion method is simple and may not preserve fine details; further research needed to improve image fusion algorithm,"Mean Square Error (MSE) loss, perceptual loss (via VGG19), adversarial loss, feature GAN loss",Supervised,GAN,"Feature-discriminator; generator with residual blocks and sub-pixel convolution, discriminator in pixel and feature domain",Pooling not specified; wavelet fusion applied after network-generation as post-processing,"Compared with SRFeat, SRCNN, and bicubic interpolation; method shows superior quantitative results on PSNR, SSIM, NIQE","Input size not explicitly stated; scale factor 4 used; some image kernel sizes described (e.g., 9x9, 3x3)","Baselines are SRFeat, SRCNN, and bicubic interpolation",Residual blocks and skip connections in generator; sub-pixel convolution layers for up-sampling; 1x1 and 3x3 convolutional layers,Not specified,"Yes, tested on both general/natural and underwater images","Noted that network does not require more depth/parameters; computational complexity not directly discussed, but claims no increase in complexity",Stochastic Gradient Descent (SGD) for optimization,"Skip connections, MSE pre-training, VGG-based perceptual loss; model is claimed stable; does not need deeper network for improvement",Learns and reconstructs high-frequency features; feature discriminator guides generation of perceptually meaningful features; wavelet fusion aimed to recover global information,,,,,,,,,,,,,
Style Transfer of Thangka Images Highlighting Style Attributes,"2023, Hu et al.",Style transfer (Thangka image style transfer),"Thangka dataset, Impressionism dataset",HAA-GAN (Highlighting Artistic Attributes Generative Adversarial Network),"Wavelet multilevel transform pooling layer applied in encoder and decoder (Wavelet_Pooling in encoder, WaveletUnPooling in decoder)","FID improved by 9.06% and PSNR by 12.7% over SAFIN, DSTN; highest PSNR and IS, lowest FID among compared methods; SSIM high (close to 1); qualified image generation rate over 80%","Model achieves precise Thangka-style attribute reconstruction, improved texture/structure retention, flexible local-global style matching, fewer artifacts, and visually superior transfer images",Key innovation: Dual-channel feature transfer in generator (style domain attribute refinement channel + self-attention semantic info matching channel); wavelet pooling layers for detailed feature extraction; dual-resolution discriminator; ablation proving each module's impact,"Evidence of robustness: Outperforms baselines on two datasets, ablation studies confirm stability and performance improvement; preserves details and generalizes to other styles (tested on cross-style images)","Dataset size (12,000 images) is limited, some data quality issues, model efficiency can improve, and objective metrics for style quality are still developing; future work is suggested on broader generalization and metric definition","Adversarial loss, binary cross-entropy, L1 distance, L2 distance (content and style loss), weighted multi-task loss (including channel-specific and mixup-based terms)",Supervised training,cGAN (conditional GAN) framework,"Dual-resolution discriminator (standard: 256x256, high-res: 512x512) using CNNs; generator: encoder-decoder with dual-channel transfer, self-attention, wavelet pooling, attribute refinement module","Wavelet pooling in encoder/decoder (both), dual-channel modules between encoder and decoder","Compared with AdaIN, SANet, CycleGAN, SAFIN, DSTN using FID, PSNR, SSIM, IS; HAA-GAN consistently superior in metrics and visual quality; ablations demonstrate modular effectiveness","256x256 for training, 512x512 also tested (dual-res discriminator); any size supported at test","AdaIN, SANet, CycleGAN, SAFIN, DSTN","Encoder-decoder structure: convolutional layers, ReLU, self-attention, Factorized Instance Normalization, wavelet pooling/unpooling, dual-channel feature transfer; discriminator: convolutional and fully connected layers",Not specified,"Validated on cross-style (style transfer between Thangka and Impressionist images), tests show generalization beyond trained pairings","Transfer speed comparable to other methods, real-time for 256x256 and 512x512; efficient for practical use. Computational demands mainly from wavelet pooling/WAN modules.","Adam optimizer, learning rate 1e-4, 2000 iterations, batch size not specified",Stability proven via ablation (modules improve convergence); regularization through attention & wavelet pooling; no instability or mode collapse reported; convergence consistent across runs,"Features learned include wavelet-transformed (frequency domain) features, style Gram matrices, local/global style, self-attended semantic matches, edge details",,,,,,,,,,,,,
